Assessment Area,Guidelines,Qualitative Assessment,Quantitative Assessment,Weight,GEA Standard Score
Open Communication and Collaboration,Consider the promotion of open communication and collaboration among employees.,,,,0
Employee Engagement Mechanisms,Consider the mechanisms for employee engagement in your organization.,,,,0
Health and Safety Policies,Consider the prioritization of employee health and safety in your organization.,,,,0
Professional Development Opportunities,Consider the provision of professional development opportunities for employees.,,,,0
"Diversity, Equity, and Inclusion","Consider the promotion of diversity, equity, and inclusion in your organization.",,,,0
Work-Life Balance and Employee Well-being,Consider the support for work-life balance and employee well-being in your organization.,,,,0