Assessment Area,Guidelines,Qualitative Assessment,Quantitative Assessment,Weight,GEA Standard Score
Understanding Customer Needs,Consider the understanding of customer needs in your organization.,,,,0
Customer Feedback Mechanisms,Consider the feedback mechanisms in place to gather insights from customers.,,,,0
Value Creation,Consider the development and delivery of products or services that provide unique value.,,,,0
Customer Relationship Management,Consider the processes for managing customer relationships in your organization.,,,,0
Customer Satisfaction Measurement,Consider the continuous measurement of customer satisfaction levels in your organization.,,,,0
Innovation Based on Customer Feedback,Consider the use of customer feedback to drive innovation in your organization.,,,,0