Assessment Area,Guidelines,Qualitative Assessment,Quantitative Assessment,Weight,GEA Standard Score
Identifying Relevant Regulations,Consider the awareness of relevant regulations in your organization.,,,,0
Developing Compliance Policies,Consider the establishment of compliance policies and procedures.,,,,0
Training and Compliance Education,Consider the education of employees about regulations and compliance.,,,,0
Compliance Monitoring and Auditing,Consider regular audits conducted to ensure adherence to regulations.,,,,0
Establishing Governance Structures,Consider the clarity of roles and responsibilities in your organization's governance structure.,,,,0
Ensuring Transparency and Accountability,Consider regular communication with stakeholders and transparent reporting practices.,,,,0